[
  {
    "id": "openai-news",
    "name": "OpenAI News",
    "type": "rss",
    "url": "https://openai.com/news/rss.xml",
    "tier": 1,
    "defaultCategory": "News",
    "enabled": true,
    "notes": "Official announcements and model releases."
  },
  {
    "id": "deepmind-blog",
    "name": "Google DeepMind Blog",
    "type": "rss",
    "url": "https://deepmind.google/blog/rss.xml",
    "tier": 1,
    "defaultCategory": "News",
    "enabled": true,
    "notes": ""
  },
  {
    "id": "google-ai-blog",
    "name": "Google AI (The Keyword)",
    "type": "rss",
    "url": "https://blog.google/technology/ai/rss/",
    "tier": 1,
    "defaultCategory": "News",
    "enabled": true,
    "notes": "Product-heavy; the keyword filter helps."
  },
  {
    "id": "google-research",
    "name": "Google Research Blog",
    "type": "rss",
    "url": "https://research.google/blog/rss/",
    "tier": 1,
    "defaultCategory": "Research",
    "enabled": true,
    "notes": ""
  },
  {
    "id": "microsoft-research",
    "name": "Microsoft Research",
    "type": "rss",
    "url": "https://www.microsoft.com/en-us/research/feed/",
    "tier": 1,
    "defaultCategory": "Research",
    "enabled": true,
    "notes": "Covers all of MSR, not only AI; keyword filter recommended."
  },
  {
    "id": "nvidia-technical-blog",
    "name": "NVIDIA Technical Blog",
    "type": "atom",
    "url": "https://developer.nvidia.com/blog/feed/",
    "tier": 1,
    "defaultCategory": "Tools & Releases",
    "enabled": true,
    "notes": ""
  },
  {
    "id": "aws-ml-blog",
    "name": "AWS Machine Learning Blog",
    "type": "rss",
    "url": "https://aws.amazon.com/blogs/machine-learning/feed/",
    "tier": 1,
    "defaultCategory": "Tools & Releases",
    "enabled": true,
    "notes": "Mostly product how-tos."
  },
  {
    "id": "huggingface-blog",
    "name": "Hugging Face Blog",
    "type": "rss",
    "url": "https://huggingface.co/blog/feed.xml",
    "tier": 1,
    "defaultCategory": "Tools & Releases",
    "enabled": true,
    "notes": ""
  },
  {
    "id": "apple-ml-research",
    "name": "Apple Machine Learning Research",
    "type": "rss",
    "url": "https://machinelearning.apple.com/rss.xml",
    "tier": 1,
    "defaultCategory": "Research",
    "enabled": true,
    "notes": ""
  },
  {
    "id": "bair-blog",
    "name": "Berkeley AI Research Blog",
    "type": "rss",
    "url": "https://bair.berkeley.edu/blog/feed.xml",
    "tier": 1,
    "defaultCategory": "Research",
    "enabled": true,
    "notes": "Low volume."
  },
  {
    "id": "anthropic-news",
    "name": "Anthropic News",
    "type": "html-list",
    "url": "https://www.anthropic.com/news",
    "tier": 1,
    "defaultCategory": "News",
    "enabled": true,
    "notes": "No official feed known; fallback is scraping the news index page."
  },
  {
    "id": "meta-ai-blog",
    "name": "Meta AI Blog",
    "type": "html-list",
    "url": "https://ai.meta.com/blog/",
    "tier": 1,
    "defaultCategory": "News",
    "enabled": true,
    "notes": "No official feed known; page may be script-rendered."
  },
  {
    "id": "mistral-news",
    "name": "Mistral AI News",
    "type": "html-list",
    "url": "https://mistral.ai/news",
    "tier": 1,
    "defaultCategory": "News",
    "enabled": true,
    "notes": "No official feed known."
  },
  {
    "id": "arxiv-cs-ai",
    "name": "arXiv cs.AI",
    "type": "rss",
    "url": "https://rss.arxiv.org/rss/cs.AI",
    "tier": 1,
    "defaultCategory": "Research",
    "enabled": true,
    "notes": "New listings; high volume, rank hard."
  },
  {
    "id": "arxiv-cs-cl",
    "name": "arXiv cs.CL",
    "type": "rss",
    "url": "https://rss.arxiv.org/rss/cs.CL",
    "tier": 1,
    "defaultCategory": "Research",
    "enabled": true,
    "notes": "New listings; high volume."
  },
  {
    "id": "arxiv-cs-lg",
    "name": "arXiv cs.LG",
    "type": "rss",
    "url": "https://rss.arxiv.org/rss/cs.LG",
    "tier": 1,
    "defaultCategory": "Research",
    "enabled": true,
    "notes": "New listings; very high volume."
  },
  {
    "id": "arxiv-cs-cv",
    "name": "arXiv cs.CV",
    "type": "rss",
    "url": "https://rss.arxiv.org/rss/cs.CV",
    "tier": 1,
    "defaultCategory": "Research",
    "enabled": true,
    "notes": "New listings; high volume."
  },
  {
    "id": "hf-daily-papers",
    "name": "Hugging Face Daily Papers",
    "type": "rss",
    "url": "https://papers.takara.ai/api/feed",
    "tier": 1,
    "defaultCategory": "Research",
    "enabled": true,
    "notes": "Unofficial mirror of huggingface.co/papers (takara.ai); HF has no official feed."
  },
  {
    "id": "verge-ai",
    "name": "The Verge: AI",
    "type": "atom",
    "url": "https://www.theverge.com/rss/ai-artificial-intelligence/index.xml",
    "tier": 2,
    "defaultCategory": "News",
    "enabled": true,
    "notes": ""
  },
  {
    "id": "techcrunch-ai",
    "name": "TechCrunch: AI",
    "type": "rss",
    "url": "https://techcrunch.com/category/artificial-intelligence/feed/",
    "tier": 2,
    "defaultCategory": "Business",
    "enabled": true,
    "notes": ""
  },
  {
    "id": "ars-technica-ai",
    "name": "Ars Technica: AI",
    "type": "rss",
    "url": "https://arstechnica.com/ai/feed/",
    "tier": 2,
    "defaultCategory": "News",
    "enabled": true,
    "notes": ""
  },
  {
    "id": "wired-ai",
    "name": "WIRED: AI",
    "type": "rss",
    "url": "https://www.wired.com/feed/tag/ai/latest/rss",
    "tier": 2,
    "defaultCategory": "News",
    "enabled": true,
    "notes": ""
  },
  {
    "id": "mit-tech-review-ai",
    "name": "MIT Technology Review: AI",
    "type": "rss",
    "url": "https://www.technologyreview.com/topic/artificial-intelligence/feed",
    "tier": 2,
    "defaultCategory": "News",
    "enabled": true,
    "notes": ""
  },
  {
    "id": "ieee-spectrum-ai",
    "name": "IEEE Spectrum: AI",
    "type": "rss",
    "url": "https://spectrum.ieee.org/feeds/topic/artificial-intelligence.rss",
    "tier": 2,
    "defaultCategory": "News",
    "enabled": true,
    "notes": ""
  },
  {
    "id": "zdnet-ai",
    "name": "ZDNET: AI",
    "type": "atom",
    "url": "https://www.zdnet.com/topic/artificial-intelligence/rss.xml",
    "tier": 2,
    "defaultCategory": "News",
    "enabled": true,
    "notes": ""
  },
  {
    "id": "simon-willison",
    "name": "Simon Willison",
    "type": "atom",
    "url": "https://simonwillison.net/atom/everything/",
    "tier": 2,
    "defaultCategory": "Opinion",
    "enabled": true,
    "notes": "Very high volume incl. short link posts."
  },
  {
    "id": "import-ai",
    "name": "Import AI",
    "type": "rss",
    "url": "https://importai.substack.com/feed",
    "tier": 2,
    "defaultCategory": "News",
    "enabled": true,
    "notes": "Weekly newsletter."
  },
  {
    "id": "ahead-of-ai",
    "name": "Ahead of AI (Sebastian Raschka)",
    "type": "rss",
    "url": "https://magazine.sebastianraschka.com/feed",
    "tier": 2,
    "defaultCategory": "Research",
    "enabled": true,
    "notes": ""
  },
  {
    "id": "interconnects",
    "name": "Interconnects (Nathan Lambert)",
    "type": "rss",
    "url": "https://www.interconnects.ai/feed",
    "tier": 2,
    "defaultCategory": "Opinion",
    "enabled": true,
    "notes": ""
  },
  {
    "id": "latent-space",
    "name": "Latent Space",
    "type": "rss",
    "url": "https://www.latent.space/feed",
    "tier": 2,
    "defaultCategory": "News",
    "enabled": true,
    "notes": "Also requested by the user."
  },
  {
    "id": "one-useful-thing",
    "name": "One Useful Thing (Ethan Mollick)",
    "type": "rss",
    "url": "https://www.oneusefulthing.org/feed",
    "tier": 2,
    "defaultCategory": "Opinion",
    "enabled": true,
    "notes": "Also requested by the user."
  },
  {
    "id": "lilian-weng",
    "name": "Lil'Log (Lilian Weng)",
    "type": "rss",
    "url": "https://lilianweng.github.io/index.xml",
    "tier": 2,
    "defaultCategory": "Research",
    "enabled": true,
    "notes": "Very low volume, high value."
  },
  {
    "id": "zvi-mowshowitz",
    "name": "Don't Worry About the Vase (Zvi)",
    "type": "rss",
    "url": "https://thezvi.substack.com/feed",
    "tier": 2,
    "defaultCategory": "Opinion",
    "enabled": true,
    "notes": "Long weekly roundups."
  },
  {
    "id": "gary-marcus",
    "name": "Marcus on AI",
    "type": "rss",
    "url": "https://garymarcus.substack.com/feed",
    "tier": 2,
    "defaultCategory": "Opinion",
    "enabled": true,
    "notes": "Skeptic viewpoint."
  },
  {
    "id": "pytorch-blog",
    "name": "PyTorch Blog",
    "type": "rss",
    "url": "https://pytorch.org/blog/feed/",
    "tier": 2,
    "defaultCategory": "Tools & Releases",
    "enabled": true,
    "notes": ""
  },
  {
    "id": "chip-huyen",
    "name": "Chip Huyen",
    "type": "rss",
    "url": "https://huyenchip.com/feed.xml",
    "tier": 2,
    "defaultCategory": "Tutorials",
    "enabled": true,
    "notes": "Low volume."
  },
  {
    "id": "eugene-yan",
    "name": "Eugene Yan",
    "type": "rss",
    "url": "https://eugeneyan.com/rss/",
    "tier": 2,
    "defaultCategory": "Tutorials",
    "enabled": true,
    "notes": ""
  },
  {
    "id": "hamel-husain",
    "name": "Hamel Husain",
    "type": "rss",
    "url": "https://hamel.dev/index.xml",
    "tier": 2,
    "defaultCategory": "Tutorials",
    "enabled": true,
    "notes": "LLM evals and applied ML."
  },
  {
    "id": "ml-mastery",
    "name": "Machine Learning Mastery",
    "type": "rss",
    "url": "https://machinelearningmastery.com/blog/feed/",
    "tier": 2,
    "defaultCategory": "Tutorials",
    "enabled": true,
    "notes": ""
  },
  {
    "id": "fast-ai",
    "name": "fast.ai",
    "type": "rss",
    "url": "https://www.fast.ai/index.xml",
    "tier": 2,
    "defaultCategory": "Tutorials",
    "enabled": true,
    "notes": "Low volume."
  },
  {
    "id": "towards-data-science",
    "name": "Towards Data Science",
    "type": "rss",